{
  "name": "Password reveal",
  "slug": "password-reveal",
  "group": "Forms",
  "tier": "P0",
  "status": "done",
  "summary": "A button inside a password field that shows and hides what was typed.",
  "description": "Add it to every password field where people type a new or existing password, so they can check it before submitting. Without JS the button does nothing and the field stays a normal password input.",
  "native": "<input type=\"password\">",
  "catalogue": [
    "Password reveal"
  ],
  "css": [
    "input.css"
  ],
  "js": [
    "components/password.js"
  ],
  "classes": [
    {
      "name": "v-password-toggle",
      "kind": "part",
      "description": "The toggle button. With two icons inside, aria-pressed decides which one shows."
    }
  ],
  "states": [
    {
      "attribute": "aria-pressed=\"true\"",
      "description": "Set by the JS while the password is visible; the second icon (eye-off) shows."
    },
    {
      "attribute": "type=\"text\"",
      "description": "The input type while revealed. The caret stays where the person left it."
    }
  ],
  "hooks": [
    {
      "name": "data-v-password",
      "value": "",
      "on": ".v-input-group",
      "description": "Wires the first button in the group to flip the first input between password and text."
    }
  ],
  "keyboard": [
    {
      "keys": [
        "Tab"
      ],
      "action": "Moves from the input to the toggle."
    },
    {
      "keys": [
        "Enter",
        "Space"
      ],
      "action": "Shows or hides the password."
    }
  ],
  "a11y": [
    "Give the button a fixed name (aria-label=\"Show password\"). aria-pressed carries the state; a name that changes with it would be read as \"Hide password, pressed\".",
    "aria-controls on the button points at the input it reveals.",
    "Both icons are aria-hidden, the button name does the talking."
  ],
  "tokens": [
    "--v-input-h",
    "--v-input-border",
    "--v-input-radius",
    "--v-focus-w"
  ],
  "related": [
    "input-group",
    "password-strength",
    "field",
    "icon-button"
  ],
  "examples": [
    {
      "title": "Password with reveal",
      "html": "<div class=\"v-field\">\n  <label class=\"v-label\" for=\"g-pw\">Password</label>\n  <div class=\"v-input-group\" data-v-password>\n    <input class=\"v-input\" id=\"g-pw\" type=\"password\" autocomplete=\"new-password\" value=\"correct-horse\" aria-describedby=\"g-pw-hint\">\n    <button class=\"v-btn v-btn-ghost v-btn-icon v-password-toggle\" type=\"button\" aria-label=\"Show password\" aria-pressed=\"false\" aria-controls=\"g-pw\"><svg class=\"v-icon\" aria-hidden=\"true\"><use href=\"/icons/sprite.svg#eye\"/></svg><svg class=\"v-icon\" aria-hidden=\"true\"><use href=\"/icons/sprite.svg#eye-off\"/></svg></button>\n  </div>\n  <p class=\"v-hint\" id=\"g-pw-hint\">At least 12 characters.</p>\n</div>",
      "layout": "stack",
      "height": 120,
      "source": "examples/forms/#groups"
    },
    {
      "title": "Revealed",
      "description": "The state after pressing the button: text input, pressed button, eye-off icon.",
      "html": "<div class=\"v-field\">\n  <label class=\"v-label\" for=\"g-pw2\">Password (revealed)</label>\n  <div class=\"v-input-group\" data-v-password>\n    <input class=\"v-input\" id=\"g-pw2\" type=\"text\" autocomplete=\"off\" value=\"correct-horse\">\n    <button class=\"v-btn v-btn-ghost v-btn-icon v-password-toggle\" type=\"button\" aria-label=\"Show password\" aria-pressed=\"true\" aria-controls=\"g-pw2\"><svg class=\"v-icon\" aria-hidden=\"true\"><use href=\"/icons/sprite.svg#eye\"/></svg><svg class=\"v-icon\" aria-hidden=\"true\"><use href=\"/icons/sprite.svg#eye-off\"/></svg></button>\n  </div>\n</div>",
      "layout": "stack",
      "height": 100,
      "source": "examples/forms/#groups"
    }
  ]
}
